{
  "schema_version": 1,
  "device_id": "00000000-0000-4000-8000-000000000001",
  "network_id": "00000000-0000-4000-8000-000000000002",
  "counter_epoch": "00000000-0000-4000-8000-000000000003",
  "sequence": 2,
  "start": "2026-10-22T10:15:00Z",
  "end": "2026-10-22T10:30:00Z",
  "kind": "gap",
  "scope": "interface_all_traffic",
  "confidence": "estimated",
  "coverage": "unknown",
  "rx_bytes": null,
  "tx_bytes": null,
  "gap_reason": "unknown"
}
